{
  "$schema": "https://json-schema.org/draft/2020-12/schema",
  "$id": "https://animundo-builder/contracts/pack-manifest.schema.json",
  "title": "Manifest of one content pack version",
  "type": "object",
  "additionalProperties": false,
  "required": [
    "draft_id",
    "draft_place_id",
    "place_id",
    "version",
    "format",
    "files",
    "new_species",
    "reused_species"
  ],
  "properties": {
    "draft_id": {"type": "string", "minLength": 1},
    "draft_place_id": {"type": "string", "pattern": "^draft_"},
    "place_id": {"type": "string", "minLength": 1},
    "version": {"type": "integer", "minimum": 1},
    "format": {"type": "integer", "minimum": 1},
    "files": {
      "type": "array",
      "minItems": 1,
      "items": {
        "type": "object",
        "additionalProperties": false,
        "required": ["path", "sha256", "bytes"],
        "properties": {
          "path": {"type": "string", "minLength": 1},
          "sha256": {"type": "string", "pattern": "^[0-9a-f]{64}$"},
          "bytes": {"type": "integer", "minimum": 0}
        }
      }
    },
    "new_species": {"type": "array", "items": {"type": "string"}},
    "reused_species": {"type": "array", "items": {"type": "string"}}
  }
}
