{
  "draft_id": "k3x9q2",
  "draft_place_id": "draft_k3x9q2",
  "place_id": "gb_cairngorms",
  "version": 3,
  "format": 1,
  "files": [
    {
      "path": "region.json",
      "sha256": "9f86d081884c7d659a2feaa0c55ad015a3bf4f1b2b0b822cd15d6c15b0f00a08",
      "bytes": 18234
    }
  ],
  "new_species": ["red_deer"],
  "reused_species": ["mountain_hare", "fox"]
}
